{
  "schema_version": 2,
  "job_id": "fingerprint-cross-recording-compare-pilot-001",
  "method": "exact_raw_bytes_v2",
  "query": {
    "role": "query",
    "result_path": "/srv/himr-media/fingerprints/query-extraction/result.json",
    "expected_result_sha256": "4444444444444444444444444444444444444444444444444444444444444444",
    "fingerprint_id": "fingerprint_query_example"
  },
  "candidate": {
    "role": "candidate",
    "result_path": "/srv/himr-media/fingerprints/candidate-extraction/result.json",
    "expected_result_sha256": "5555555555555555555555555555555555555555555555555555555555555555",
    "fingerprint_id": "fingerprint_candidate_example"
  },
  "output": {
    "root": "/srv/himr-media/fingerprint-comparisons"
  }
}
